[
  {
    "id": "bias_wysiati",
    "parent_lens": "bias_heuristics",
    "name": "眼见即全部",
    "source_work": "《思考，快与慢》",
    "mechanism": "数字人把当前账本中可见的信息误当成问题的全部信息，遗漏的维度不会进入不确定性估计。",
    "trigger_signals": ["证据覆盖窄但置信度高", "很少提到未知未知", "忽略来源不进入结论限定"],
    "diagnostic_questions": ["该数字人把没有看到的东西当作不存在了吗？", "它是否把账本完整性误当成世界完整性？"],
    "differentiates_from": ["noise", "argument_forensics"],
    "inversion_hint": "把缺失维度转成负空间洞，并降低完整性置信度。",
    "misuse_warning": "不要因为账本不完整就否定已采信证据；先区分局部事实和整体外推。"
  },
  {
    "id": "bias_anchoring",
    "parent_lens": "bias_heuristics",
    "name": "锚定效应",
    "source_work": "《思考，快与慢》",
    "mechanism": "第一批数字、案例、类比或问题措辞成为隐性参照点，后续修正不足。",
    "trigger_signals": ["搜索词沿初始表述扩展", "估计值贴近第一条材料", "后续反证只做小幅修正"],
    "diagnostic_questions": ["如果换一个初始锚点，结论会改变多少？", "该数字人是否充分离开了第一印象？"],
    "differentiates_from": ["interpreter", "social_influence"],
    "inversion_hint": "生成反锚点数字人，扩大约束带。",
    "misuse_warning": "不要把所有稳定结论都叫锚定；需要识别清楚初始参照点。"
  },
  {
    "id": "bias_availability",
    "parent_lens": "bias_heuristics",
    "name": "可得性启发",
    "source_work": "《思考，快与慢》",
    "mechanism": "生动、近期、容易回忆的案例被误当成高频或高代表性事实。",
    "trigger_signals": ["事故、爆款、极端个案权重过高", "缺少基准率", "短新闻替代长期统计"],
    "diagnostic_questions": ["该案例是生动，还是典型？", "有没有基准率能校准它？"],
    "differentiates_from": ["emotion_reason", "social_influence"],
    "inversion_hint": "要求补基准率；个案可保留为尾部风险或体验证据。",
    "misuse_warning": "生动案例可能揭示真实机制，不应自动降权为噪声。"
  },
  {
    "id": "bias_representativeness",
    "parent_lens": "bias_heuristics",
    "name": "代表性替代",
    "source_work": "《思考，快与慢》",
    "mechanism": "数字人用相似性、典型故事或熟悉模板替代概率、规模和因果审计。",
    "trigger_signals": ["类比很强但数据薄", "从少数相似案例外推", "忽略样本大小"],
    "diagnostic_questions": ["这个类比在哪些关键变量上不成立？", "样本大小和选择过程是什么？"],
    "differentiates_from": ["argument_forensics", "expert_failure"],
    "inversion_hint": "保留类比启发，要求补规模证据和边界条件。",
    "misuse_warning": "类比不是证据废料；它可能是生成假设的好材料。"
  },
  {
    "id": "bias_loss_aversion",
    "parent_lens": "bias_heuristics",
    "name": "损失厌恶",
    "source_work": "《思考，快与慢》",
    "mechanism": "潜在损失比同等收益更显著，导致保守或灾难化判断。",
    "trigger_signals": ["风险代价被反复强调", "机会成本缺席", "安全价值压倒其他维度"],
    "diagnostic_questions": ["收益和损失是否被等距比较？", "保守方案的隐性损失是什么？"],
    "differentiates_from": ["emotion_reason", "ecological_rationality"],
    "inversion_hint": "生成机会成本约束带，避免单向风险框架。",
    "misuse_warning": "某些高尾部风险场景下，损失厌恶可能是适应性警报。"
  },
  {
    "id": "bias_overconfidence",
    "parent_lens": "bias_heuristics",
    "name": "过度自信",
    "source_work": "《思考，快与慢》",
    "mechanism": "数字人把叙事流畅度、专业身份或局部证据误当成确定性。",
    "trigger_signals": ["证据少但结论强", "置信度高于账本质量", "很少列失败条件"],
    "diagnostic_questions": ["置信度由什么支撑？", "它是否能给出会使自己错的条件？"],
    "differentiates_from": ["expert_failure", "interpreter"],
    "inversion_hint": "下调结论权重，要求概率区间和失败条件。",
    "misuse_warning": "自信表达不等于过度自信；要看校准和证据。"
  },
  {
    "id": "noise_level_noise",
    "parent_lens": "noise",
    "name": "水平噪声",
    "source_work": "《噪声：人类判断的缺陷》",
    "mechanism": "同类数字人整体判断水平有系统差异，但这种差异不是稳定价值方向。",
    "trigger_signals": ["相似身份整体偏高或偏低", "没有明确理由解释水平差", "估计尺度漂移"],
    "diagnostic_questions": ["同类判断者的平均水平是否一致？", "差异是尺度问题还是事实分歧？"],
    "differentiates_from": ["bias_heuristics", "expert_failure"],
    "inversion_hint": "校准尺度，扩大区间，不直接做偏向反演。",
    "misuse_warning": "水平差若与价值或利益稳定同向，可能不是噪声。"
  },
  {
    "id": "noise_pattern_noise",
    "parent_lens": "noise",
    "name": "模式噪声",
    "source_work": "《噪声：人类判断的缺陷》",
    "mechanism": "数字人对不同子问题的偏差模式不一致，导致看似有理却难以归因的分散。",
    "trigger_signals": ["某人对安全保守、对成本激进", "差异在子维度间跳动", "无稳定价值解释"],
    "diagnostic_questions": ["分歧是否只在某些子任务上出现？", "是否存在未建模的交互变量？"],
    "differentiates_from": ["paradigm", "bias_heuristics"],
    "inversion_hint": "拆分子维度，分别设误差棒。",
    "misuse_warning": "不要把所有复杂模式都叫范式冲突。"
  },
  {
    "id": "noise_occasion_noise",
    "parent_lens": "noise",
    "name": "情境噪声",
    "source_work": "《噪声：人类判断的缺陷》",
    "mechanism": "判断受顺序、措辞、临时上下文影响，重跑可能漂移。",
    "trigger_signals": ["轻微改写问题导致结论变化", "证据顺序影响明显", "同类 persona 重采样不稳"],
    "diagnostic_questions": ["若换顺序或重问，判断会稳定吗？", "差异是机制还是情境扰动？"],
    "differentiates_from": ["framing", "interpreter"],
    "inversion_hint": "建议重复采样，低稳定维度不生成强锚点。",
    "misuse_warning": "框架效应有方向，情境噪声不一定有方向。"
  },
  {
    "id": "noise_decision_hygiene",
    "parent_lens": "noise",
    "name": "决策卫生缺失",
    "source_work": "《噪声：人类判断的缺陷》",
    "mechanism": "缺少独立判断、统一尺度和后验校准，使群体输出被无规律变异污染。",
    "trigger_signals": ["数字人彼此污染", "评分标准不统一", "没有先独立后汇总"],
    "diagnostic_questions": ["判断是否独立产生？", "不同数字人使用同一置信尺度吗？"],
    "differentiates_from": ["social_influence", "argument_forensics"],
    "inversion_hint": "先独立采样，再统一尺度，再汇总。",
    "misuse_warning": "不要用流程卫生替代实质诊断；它是校准层。"
  },
  {
    "id": "emotion_somatic_marker_missing",
    "parent_lens": "emotion_reason",
    "name": "躯体标记缺失",
    "source_work": "《笛卡尔的错误》",
    "mechanism": "数字人缺少对伤害、恐惧、羞辱和尊严成本的价值标记，导致决策比例感失真。",
    "trigger_signals": ["人类代价被指标化", "受影响者经验缺席", "纯效率语言覆盖痛苦"],
    "diagnostic_questions": ["这里有没有身体性或尊严成本？", "数字人是否把人当成变量？"],
    "differentiates_from": ["argument_forensics", "ecological_rationality"],
    "inversion_hint": "补受影响者数字人，生成价值约束带。",
    "misuse_warning": "不能用情绪成本免除事实检验。"
  },
  {
    "id": "emotion_affect_salience",
    "parent_lens": "emotion_reason",
    "name": "情感显著性放大",
    "source_work": "《笛卡尔的错误》",
    "mechanism": "恐惧、愤怒、同情或乐观使某类后果变得过度显著。",
    "trigger_signals": ["灾难、机会或伤害被反复前置", "temperament 与结论方向一致", "低概率结果过度支配"],
    "diagnostic_questions": ["这个后果是重要，还是只是显著？", "同等规模的反向后果在哪里？"],
    "differentiates_from": ["bias_availability", "bias_loss_aversion"],
    "inversion_hint": "保留价值信号，要求概率和规模校准。",
    "misuse_warning": "显著性过强不等于后果不存在。"
  },
  {
    "id": "emotion_pseudo_objectivity",
    "parent_lens": "emotion_reason",
    "name": "伪客观冷静",
    "source_work": "《笛卡尔的错误》",
    "mechanism": "数字人用冷静、量化、技术语言遮蔽自己的价值选择。",
    "trigger_signals": ["声称只看事实但选择了价值指标", "不承认权衡", "情绪性证据被一概排除"],
    "diagnostic_questions": ["所谓客观指标背后选择了什么价值？", "被排除的体验是否承载真实成本？"],
    "differentiates_from": ["argument_forensics", "expert_failure"],
    "inversion_hint": "把隐性价值显性化，形成价值冲突边界。",
    "misuse_warning": "量化不是错，错在把量化选择伪装成无价值判断。"
  },
  {
    "id": "emotion_moral_injury",
    "parent_lens": "emotion_reason",
    "name": "道德伤害盲区",
    "source_work": "《笛卡尔的错误》",
    "mechanism": "政策或技术改变造成身份、尊严、信任和道德秩序损伤，但数字人只看物质成本。",
    "trigger_signals": ["忽略羞辱、背叛、被替代感", "只讨论补偿和效率", "公共反弹被看成非理性"],
    "diagnostic_questions": ["人们反对的是损失，还是被对待的方式？", "尊严成本有没有被记录？"],
    "differentiates_from": ["social_influence", "paradigm"],
    "inversion_hint": "生成负空间洞，要求质性叙事补证。",
    "misuse_warning": "不要把所有反对都解释成道德伤害；可能也有事实利益。"
  },
  {
    "id": "interpreter_post_hoc_story",
    "parent_lens": "interpreter",
    "name": "事后故事化",
    "source_work": "《谁说了算？自由意志的科学》",
    "mechanism": "结论先由隐性过程生成，推理随后把它包装成连续故事。",
    "trigger_signals": ["推理过顺", "无真实分叉", "所有证据都支持同一方向"],
    "diagnostic_questions": ["如果把理由拿走，结论是否仍会保留？", "有没有真实改变主意的路径？"],
    "differentiates_from": ["argument_forensics", "bias_overconfidence"],
    "inversion_hint": "把故事链降权，保留价值方向和证据片段。",
    "misuse_warning": "不是所有连贯叙事都是虚假包装。"
  },
  {
    "id": "interpreter_confabulation",
    "parent_lens": "interpreter",
    "name": "编造性解释",
    "source_work": "《隐藏的自我》",
    "mechanism": "数字人为自己无法访问的真实原因生成听起来合理但不可证伪的解释。",
    "trigger_signals": ["原因解释太全", "没有不确定性", "解释无法被证据触发改变"],
    "diagnostic_questions": ["这个解释能被证伪吗？", "它解释太多是否反而降低可信度？"],
    "differentiates_from": ["expert_failure", "paradigm"],
    "inversion_hint": "标记为低证据叙事，要求行为/账本证据。",
    "misuse_warning": "不可访问原因不等于不存在原因；谨慎下结论。"
  },
  {
    "id": "interpreter_identity_preservation",
    "parent_lens": "interpreter",
    "name": "自我一致维护",
    "source_work": "《谁说了算？自由意志的科学》",
    "mechanism": "数字人维护一个稳定自我形象，拒绝让结论威胁自己的身份一致性。",
    "trigger_signals": ["结论总维护 persona 身份", "反证被解释为例外", "改变主意条件不可触发"],
    "diagnostic_questions": ["如果承认反证，会伤害它的身份吗？", "它在保护结论还是保护自我？"],
    "differentiates_from": ["social_influence", "bias_heuristics"],
    "inversion_hint": "生成身份反向数字人测试该结论。",
    "misuse_warning": "身份一致不必然虚假；可能身份来自真实经验。"
  },
  {
    "id": "interpreter_change_condition_fake",
    "parent_lens": "interpreter",
    "name": "虚假翻转条件",
    "source_work": "《隐藏的自我》",
    "mechanism": "数字人声称有改变主意条件，但条件过高、过空或不可观测。",
    "trigger_signals": ["what_would_change_my_mind 抽象", "要求不现实证据", "反证标准不对称"],
    "diagnostic_questions": ["这个条件现实中能被满足吗？", "支持证据和反对证据标准一致吗？"],
    "differentiates_from": ["argument_forensics", "social_influence"],
    "inversion_hint": "降低该结论开放性评分，要求具体反事实测试。",
    "misuse_warning": "高证据标准有时合理，尤其在高风险决策中。"
  },
  {
    "id": "social_authority",
    "parent_lens": "social_influence",
    "name": "权威线索替代",
    "source_work": "《影响力》",
    "mechanism": "数字人用来源权威替代证据质量审计。",
    "trigger_signals": ["权威机构被高信任", "很少检查方法", "低地位来源被忽略"],
    "diagnostic_questions": ["权威提供的是事实、解释还是声望？", "方法质量是否被检查？"],
    "differentiates_from": ["expert_failure", "argument_forensics"],
    "inversion_hint": "拆分权威声望和证据方法；引入低地位反证。",
    "misuse_warning": "成熟领域的权威常有真实质量优势。"
  },
  {
    "id": "social_proof",
    "parent_lens": "social_influence",
    "name": "社会认同",
    "source_work": "《影响力》",
    "mechanism": "多数人、行业热度或主流叙事被当成正确性线索。",
    "trigger_signals": ["主流共识权重过高", "热潮被当证据", "少数反例被轻视"],
    "diagnostic_questions": ["多数共识来自独立判断还是互相模仿？", "低声量证据在哪里？"],
    "differentiates_from": ["noise_decision_hygiene", "paradigm"],
    "inversion_hint": "查独立性；若非独立，降权为同源信号。",
    "misuse_warning": "共识不等于错误；要看形成机制。"
  },
  {
    "id": "social_commitment_consistency",
    "parent_lens": "social_influence",
    "name": "承诺一致",
    "source_work": "《影响力》",
    "mechanism": "数字人为维持过去立场、组织承诺或身份承诺而筛选信息。",
    "trigger_signals": ["结论维护旧立场", "反证被低估", "承认错误成本很高"],
    "diagnostic_questions": ["改变结论会让它失去什么承诺？", "是否存在升级承诺？"],
    "differentiates_from": ["interpreter_identity_preservation", "expert_failure"],
    "inversion_hint": "模拟无承诺版本数字人，比较判断变化。",
    "misuse_warning": "立场稳定可能来自证据稳定，不必然是承诺绑架。"
  },
  {
    "id": "social_in_group",
    "parent_lens": "social_influence",
    "name": "群体内偏爱",
    "source_work": "《影响力》",